{
  "weave": "1",
  "id": "proposal-compare-1",
  "title": "제안서 나란히 보기",
  "facets": [
    {
      "id": "first-premium",
      "title": "초회 보험료",
      "element": "stat",
      "fields": [
        {
          "key": "first-premium",
          "label": "초회 보험료",
          "shape": "single",
          "type": "money",
          "description": "첫 회에 실제로 빠져나가는 월 보험료 총액을 원 단위 정수로. 합계보험료에 적립보험료가 섞여 있으면 빼고 보장보험료만 담는다."
        }
      ],
      "notes": [
        {
          "kind": "note",
          "text": "처음 한 번 내는 금액이 아니라 첫 달에 내는 월 보험료입니다."
        },
        {
          "kind": "caution",
          "text": "갱신형은 이 금액이 갱신할 때마다 달라집니다. 지금 금액만으로 견주면 안 됩니다."
        }
      ]
    },
    {
      "id": "contract-terms",
      "title": "얼마나 내고 언제까지 받나",
      "element": "facts",
      "fields": [
        {
          "key": "payment-period",
          "label": "납입기간",
          "shape": "single",
          "type": "duration",
          "description": "보험료를 내는 총 기간을 개월로. 20년납이면 240, 10년납이면 120. 전기납이면 만기까지의 개월 수로 환산한다."
        },
        {
          "key": "maturity-age",
          "label": "만기나이",
          "shape": "single",
          "type": "age",
          "description": "보장이 끝나는 나이를 세로. 종신이면 값을 비우고 종신이라고 주석에 적는다."
        },
        {
          "key": "entry-age",
          "label": "가입나이",
          "shape": "range",
          "type": "age",
          "description": "가입할 수 있는 나이 구간을 세로. 한쪽만 적혀 있으면 그쪽만 담는다."
        }
      ],
      "notes": [
        {
          "kind": "tip",
          "text": "납입기간이 짧으면 월 보험료는 비싸지지만 내는 총액은 대체로 적습니다."
        },
        {
          "kind": "tip",
          "text": "만기나이가 비어 있고 종신이라고 적혀 있으면 죽을 때까지 보장한다는 뜻입니다."
        }
      ]
    },
    {
      "id": "renewal",
      "title": "갱신되나",
      "element": "facts",
      "fields": [
        {
          "key": "renews",
          "label": "갱신 여부",
          "shape": "single",
          "type": "boolean",
          "description": "갱신형이면 참, 비갱신형이면 거짓. 주계약 기준으로 본다. 일부 특약만 갱신형이면 거짓으로 두고 주의 주석을 단다."
        },
        {
          "key": "renewal-cycle",
          "label": "갱신주기",
          "shape": "single",
          "type": "duration",
          "description": "몇 개월마다 갱신되는지를 개월로. 10년 갱신이면 120, 5년 갱신이면 60. 비갱신형이면 값을 비운다."
        }
      ],
      "notes": [
        {
          "kind": "tip",
          "text": "갱신형은 처음 보험료가 싼 대신 갱신할 때마다 나이에 맞춰 오릅니다. 비갱신형은 처음이 비싼 대신 끝까지 그대로입니다."
        },
        {
          "kind": "note",
          "text": "갱신 여부는 보험료가 앞으로 어떻게 될지를 가르는 자리라 따로 봅니다."
        }
      ]
    },
    {
      "id": "coverage-amounts",
      "title": "주요 보장의 가입금액",
      "element": "bars",
      "fields": [
        {
          "key": "death",
          "label": "일반사망",
          "shape": "single",
          "type": "money",
          "description": "일반사망 보험금 가입금액을 원 단위 정수로. 재해사망과 상해사망은 빼고 일반사망만."
        },
        {
          "key": "cancer",
          "label": "암진단비",
          "shape": "single",
          "type": "money",
          "description": "일반암 진단비 가입금액을 원 단위 정수로. 유사암(갑상선암·기타피부암·제자리암·경계성종양)은 빼고 일반암만."
        },
        {
          "key": "brain",
          "label": "뇌혈관질환진단비",
          "shape": "single",
          "type": "money",
          "description": "뇌혈관질환 진단비 가입금액을 원 단위 정수로. 뇌졸중이나 뇌출혈만 보장하는 담보는 범위가 다르니 주석에 적는다."
        }
      ],
      "notes": [
        {
          "kind": "caution",
          "text": "가입금액은 받을 수 있는 최대 금액이고 실제 지급 조건은 약관이 정합니다."
        },
        {
          "kind": "note",
          "text": "막대 길이는 항목마다 따로 잽니다. 서로 다른 항목의 길이를 견주면 안 됩니다."
        }
      ]
    },
    {
      "id": "renewal-premium",
      "title": "갱신 시점별 예상 보험료",
      "element": "line",
      "fields": [
        {
          "key": "premium-curve",
          "label": "월 보험료",
          "shape": "series",
          "type": "money",
          "axis": "age",
          "description": "설계안의 갱신 예시표에 적힌 나이별 예상 월 보험료를 나이(세)와 금액(원)의 점들로. 표에 적힌 나이만 담고 사이를 채우지 않는다. 비갱신형이라 예시표가 없으면 값을 비운다."
        }
      ],
      "notes": [
        {
          "kind": "caution",
          "text": "예시표의 금액은 지금 기준으로 계산한 예상치이고 실제 갱신 보험료는 그때 가서 정해집니다."
        }
      ]
    },
    {
      "id": "riders",
      "title": "어떤 특약이 붙었나",
      "element": "list",
      "fields": [
        {
          "key": "rider-list",
          "label": "특약 목록",
          "shape": "items",
          "description": "설계안 보장내역 표에 적힌 특약을 하나씩. 주계약은 빼고 특약만 담는다. 특약이 하나도 없으면 빈 목록으로 둔다.",
          "columns": [
            {
              "key": "name",
              "label": "특약명",
              "type": "text",
              "description": "설계안에 적힌 특약 이름 그대로. 줄이거나 고쳐 쓰지 않는다."
            },
            {
              "key": "amount",
              "label": "가입금액",
              "type": "money",
              "description": "그 특약의 가입금액을 원 단위 정수로. 일당처럼 하루 금액이면 하루 금액 그대로."
            },
            {
              "key": "renews",
              "label": "갱신",
              "type": "boolean",
              "description": "그 특약이 갱신형이면 참, 비갱신형이면 거짓."
            },
            {
              "key": "maturity-age",
              "label": "만기",
              "type": "age",
              "description": "그 특약이 끝나는 나이를 세로. 표에 적혀 있지 않으면 비운다."
            }
          ]
        }
      ],
      "notes": [
        {
          "kind": "note",
          "text": "주계약은 빼고 특약만 담습니다. 특약이 없으면 빈 목록입니다."
        },
        {
          "kind": "tip",
          "text": "특약 하나하나의 만기와 갱신 여부가 주계약과 다를 수 있습니다."
        }
      ]
    },
    {
      "id": "payment-plan",
      "title": "언제 얼마씩 내나",
      "element": "rows",
      "fields": [
        {
          "key": "plan",
          "label": "납입 계획",
          "shape": "items",
          "hint": "고른 제안서의 것만 폅니다.",
          "description": "설계안에 적힌 납입 구간을 적힌 순서 그대로 하나씩 담는다.",
          "columns": [
            {
              "key": "phase",
              "label": "구간",
              "type": "text",
              "description": "그 구간을 부르는 말 그대로 담는다."
            },
            {
              "key": "monthly",
              "label": "월 보험료",
              "type": "money",
              "description": "그 구간의 월 보험료를 원 단위 정수로 담는다."
            },
            {
              "key": "until",
              "label": "언제까지",
              "type": "age",
              "description": "그 구간이 끝나는 나이를 정수로 담는다."
            }
          ]
        }
      ],
      "notes": [
        {
          "kind": "note",
          "text": "지금 고른 제안서의 납입 계획만 폅니다. 나란히 견주는 자리가 아닙니다."
        }
      ]
    }
  ]
}
