{
  "weave": "1",
  "id": "half-read-1",
  "title": "스캔에서 읽은 것",
  "facets": [
    {
      "id": "first-premium",
      "title": "초회 보험료",
      "element": "stat",
      "fields": [
        {
          "key": "first-premium",
          "label": "초회 보험료",
          "shape": "single",
          "type": "money",
          "description": "첫 달 월 보험료 총액을 원 단위 정수로. 읽을 수 없으면 비우고 왜 못 읽었는지 주석에 적는다."
        }
      ],
      "notes": [
        { "kind": "note", "text": "설계안 첫 쪽 합계보험료입니다." },
        { "kind": "caution", "text": "스캔이 흐리면 자릿수를 잘못 읽기 쉽습니다. 확신이 없으면 비우는 쪽이 낫습니다." }
      ]
    },
    {
      "id": "renewal",
      "title": "갱신되나",
      "element": "facts",
      "fields": [
        {
          "key": "renews",
          "label": "갱신 여부",
          "shape": "single",
          "type": "boolean",
          "description": "갱신형이면 참, 비갱신형이면 거짓. 주계약 기준으로 본다."
        },
        {
          "key": "renewal-cycle",
          "label": "갱신주기",
          "shape": "single",
          "type": "duration",
          "description": "몇 개월마다 갱신되는지를 개월로. 10년 갱신이면 120. 비갱신형이면 비운다."
        },
        {
          "key": "payment-period",
          "label": "납입기간",
          "shape": "single",
          "type": "duration",
          "description": "보험료를 내는 총 기간을 개월로. 20년납이면 240."
        },
        {
          "key": "maturity-age",
          "label": "만기나이",
          "shape": "single",
          "type": "age",
          "description": "보장이 끝나는 나이를 세로. 종신이면 비우고 종신이라고 주석에 적는다."
        }
      ],
      "notes": [
        { "kind": "tip", "text": "갱신형은 처음 보험료가 싼 대신 갱신할 때마다 오릅니다. 비갱신형은 처음이 비싼 대신 그대로입니다." },
        { "kind": "note", "text": "이 지식은 subject 가 하나도 분석되지 않아도 화면에 남습니다. 템플릿에 달린 주석이기 때문입니다." }
      ]
    },
    {
      "id": "riders",
      "title": "읽어 낸 특약",
      "element": "list",
      "fields": [
        {
          "key": "rider-list",
          "label": "특약 목록",
          "shape": "items",
          "description": "보장내역 표에서 읽어 낸 특약을 하나씩. 주계약은 뺀다. 표를 못 읽었으면 값을 비운다.",
          "columns": [
            { "key": "name", "label": "특약명", "type": "text", "description": "적힌 이름 그대로. 줄이거나 고쳐 쓰지 않는다." },
            { "key": "amount", "label": "가입금액", "type": "money", "description": "그 특약의 가입금액을 원 단위 정수로. 못 읽었으면 그 칸을 비운다." }
          ]
        }
      ],
      "notes": [
        { "kind": "caution", "text": "표가 잘렸거나 흐려서 못 읽은 줄은 목록에 없습니다. 목록이 짧다고 특약이 적은 것은 아닙니다." }
      ]
    }
  ]
}
