{
  "weave": "1",
  "id": "single-proposal-1",
  "title": "받은 제안서 한 장",
  "facets": [
    {
      "id": "first-premium",
      "title": "매달 얼마를 내나",
      "element": "stat",
      "fields": [
        {
          "key": "first-premium",
          "label": "초회 보험료",
          "shape": "single",
          "type": "money",
          "description": "첫 달에 실제로 빠져나가는 월 보험료 총액을 원 단위 정수로. 적립보험료가 섞여 있으면 빼고 보장보험료만 담는다."
        }
      ],
      "notes": [
        { "kind": "tip", "text": "설계안 첫 쪽의 합계보험료가 이 금액입니다. 적립보험료가 섞여 있으면 실제 보장에 쓰이는 돈은 이보다 적습니다." }
      ]
    },
    {
      "id": "contract-terms",
      "title": "얼마나 내고 언제까지 받나",
      "element": "facts",
      "fields": [
        {
          "key": "payment-period",
          "label": "납입기간",
          "shape": "single",
          "type": "duration",
          "description": "보험료를 내는 총 기간을 개월로. 20년납이면 240. 전기납이면 만기까지의 개월 수로 환산한다."
        },
        {
          "key": "maturity-age",
          "label": "만기나이",
          "shape": "single",
          "type": "age",
          "description": "보장이 끝나는 나이를 세로. 종신이면 값을 비우고 종신이라고 주석에 적는다."
        },
        {
          "key": "entry-age",
          "label": "가입나이",
          "shape": "range",
          "type": "age",
          "description": "가입할 수 있는 나이 구간을 세로. 한쪽만 적혀 있으면 그쪽만 담는다."
        },
        {
          "key": "renews",
          "label": "갱신 여부",
          "shape": "single",
          "type": "boolean",
          "description": "갱신형이면 참, 비갱신형이면 거짓. 주계약 기준으로 본다."
        }
      ],
      "notes": [
        { "kind": "note", "text": "설계안 계약사항 표에서 읽는 값들입니다." },
        { "kind": "tip", "text": "납입기간이 만기보다 짧으면 그 뒤로는 안 내고 보장만 받습니다." }
      ]
    },
    {
      "id": "coverage-amounts",
      "title": "주요 보장의 가입금액",
      "element": "bars",
      "fields": [
        {
          "key": "death",
          "label": "일반사망",
          "shape": "single",
          "type": "money",
          "description": "일반사망 보험금 가입금액을 원 단위 정수로. 재해사망과 상해사망은 빼고 일반사망만."
        },
        {
          "key": "cancer",
          "label": "암진단비",
          "shape": "single",
          "type": "money",
          "description": "일반암 진단비 가입금액을 원 단위 정수로. 유사암은 빼고 일반암만."
        }
      ],
      "notes": [
        { "kind": "caution", "text": "가입금액은 받을 수 있는 최대 금액이고 실제 지급 조건은 약관이 정합니다." }
      ]
    },
    {
      "id": "riders",
      "title": "어떤 특약이 붙었나",
      "element": "list",
      "fields": [
        {
          "key": "rider-list",
          "label": "특약 목록",
          "shape": "items",
          "description": "설계안 보장내역 표에 적힌 특약을 하나씩. 주계약은 빼고 특약만 담는다. 특약이 하나도 없으면 빈 목록으로 둔다.",
          "columns": [
            { "key": "name", "label": "특약명", "type": "text", "description": "설계안에 적힌 특약 이름 그대로. 줄이거나 고쳐 쓰지 않는다." },
            { "key": "amount", "label": "가입금액", "type": "money", "description": "그 특약의 가입금액을 원 단위 정수로." },
            { "key": "renews", "label": "갱신", "type": "boolean", "description": "그 특약이 갱신형이면 참, 비갱신형이면 거짓." }
          ]
        }
      ],
      "notes": [
        { "kind": "tip", "text": "특약 하나하나의 갱신 여부가 주계약과 다를 수 있습니다. 주계약이 비갱신형이어도 특약이 갱신형이면 보험료는 오릅니다." }
      ]
    }
  ]
}
