{
  "weave": "1",
  "id": "premium-split-1",
  "title": "내 보험료가 어디에 쓰이나",
  "facets": [
    {
      "id": "premium",
      "title": "다달이 내는 돈",
      "element": "stat",
      "fields": [
        {
          "key": "monthly",
          "label": "월 보험료",
          "shape": "single",
          "description": "이 제안서의 월 납입 보험료 총액을 원 단위 정수로.",
          "type": "money",
          "hint": "이 제안서에서 매달 빠져나가는 돈이에요."
        }
      ],
      "notes": [
        {
          "kind": "note",
          "text": "아래 조각을 다 더하면 이 금액이 됩니다."
        }
      ]
    },
    {
      "id": "split",
      "title": "그 돈이 어디로 가나",
      "element": "parts",
      "fields": [
        {
          "key": "share",
          "label": "몫",
          "shape": "items",
          "description": "월 보험료를 주계약과 특약별로 쪼개 각 몫을 원 단위 정수로. 설계안에 몫이 적혀 있지 않으면 비운다.",
          "hint": "월 보험료를 쪼갠 것이에요.",
          "columns": [
            {
              "key": "part",
              "label": "어디",
              "type": "text",
              "description": "주계약이면 주계약, 특약이면 그 특약 이름 그대로 담는다."
            },
            {
              "key": "amount",
              "label": "몫",
              "type": "money",
              "description": "그 몫의 월 보험료를 원 단위 정수로 담는다."
            }
          ]
        }
      ],
      "notes": [
        {
          "kind": "note",
          "text": "조각의 차례는 설계안에 적힌 차례입니다. 크기 순서가 아닙니다."
        },
        {
          "kind": "tip",
          "text": "주계약 몫이 크면 보장을 늘리려 할 때 보험료가 빨리 오릅니다."
        }
      ]
    },
    {
      "id": "covered",
      "title": "무엇이 들어 있나",
      "element": "facts",
      "fields": [
        {
          "key": "brain",
          "label": "뇌혈관질환진단비",
          "shape": "single",
          "description": "뇌혈관질환 진단 담보의 가입금액을 원 단위 정수로. 없으면 비운다.",
          "type": "money",
          "hint": "뇌혈관질환으로 진단받으면 나오는 금액이에요."
        },
        {
          "key": "heart",
          "label": "허혈성심장질환진단비",
          "shape": "single",
          "description": "허혈성심장질환 진단 담보의 가입금액을 원 단위 정수로. 없으면 비운다.",
          "type": "money",
          "hint": "허혈성심장질환으로 진단받으면 나오는 금액이에요."
        },
        {
          "key": "cancer",
          "label": "암진단비",
          "shape": "single",
          "description": "암 진단 담보의 가입금액을 원 단위 정수로. 없으면 비운다.",
          "type": "money",
          "hint": "암으로 진단받으면 나오는 금액이에요."
        },
        {
          "key": "main",
          "label": "주계약",
          "shape": "single",
          "description": "주계약이 무엇을 보장하는지 설계안에 적힌 이름 그대로.",
          "type": "text",
          "hint": "특약을 붙이려면 반드시 있어야 하는 계약이에요."
        }
      ],
      "notes": [
        {
          "kind": "caution",
          "text": "빈 자리는 이 설계안에서 읽지 못했다는 뜻이고, 0원은 보장이 없다는 뜻입니다."
        }
      ]
    }
  ]
}
