{
  "weave": "1",
  "id": "stat-row-1",
  "title": "한 줄로 견주기",
  "facets": [
    {
      "id": "first-premium",
      "title": "초회 보험료",
      "element": "stat",
      "fields": [
        {
          "key": "first-premium",
          "label": "월 보험료",
          "shape": "single",
          "type": "money",
          "description": "첫 달에 실제로 빠져나가는 월 보험료 총액을 원 단위 정수로. 적립보험료가 섞여 있으면 빼고 보장보험료만 담는다."
        }
      ],
      "notes": [
        { "kind": "caution", "text": "갱신형은 이 금액이 갱신할 때마다 달라집니다. 지금 금액만으로 견주면 안 됩니다." }
      ]
    },
    {
      "id": "payment-period",
      "title": "납입기간",
      "element": "stat",
      "fields": [
        {
          "key": "payment-period",
          "label": "내는 기간",
          "shape": "single",
          "type": "duration",
          "description": "보험료를 내는 총 기간을 개월로. 20년납이면 240. 전기납이면 만기까지의 개월 수로 환산한다."
        }
      ],
      "notes": [
        { "kind": "tip", "text": "납입기간이 짧으면 월 보험료는 비싸지지만 내는 총액은 대체로 적습니다." }
      ]
    },
    {
      "id": "maturity-age",
      "title": "만기나이",
      "element": "stat",
      "fields": [
        {
          "key": "maturity-age",
          "label": "보장이 끝나는 나이",
          "shape": "single",
          "type": "age",
          "description": "보장이 끝나는 나이를 세로. 종신이면 값을 비우고 종신이라고 주석에 적는다."
        }
      ],
      "notes": [
        { "kind": "tip", "text": "값이 비어 있고 종신이라고 적혀 있으면 죽을 때까지 보장한다는 뜻입니다." }
      ]
    },
    {
      "id": "renews",
      "title": "갱신 여부",
      "element": "stat",
      "fields": [
        {
          "key": "renews",
          "label": "갱신형인가",
          "shape": "single",
          "type": "boolean",
          "description": "갱신형이면 참, 비갱신형이면 거짓. 주계약 기준으로 본다."
        }
      ],
      "notes": [
        { "kind": "note", "text": "stat 은 수만 담는 자리가 아닙니다. 참거짓도 값 하나입니다." }
      ]
    }
  ]
}
